attribute_key,label,label_zh,theme,attribute_group,definition,source_type,mention_count,salience_column,quality_column,example_review_id,example_quote,theory_families,theory_subtheories,applicable_products
shareable_between_partners,Shareable Between Partners,夫妻/伴侶共享設計,Social Context,benefit_use,Whether the product design facilitates use by both partners. High=explicitly suitable for sharing; Low=single-user design.,review,8,shareable_between_partners_salience,shareable_between_partners_quality,B0BVVKKXFZ,My partner and I use this interchangeably.,"product_positioning,maslow,purchase_motivation","benefits,belongingness,relational","B0BVVKKXFZ,B083NFMGZH"
battery_independence,Battery Independence (Rechargeable),可充電免拋棄式電池,Eco & Sustainability,benefit_use,"Whether the product reduces need for disposable batteries (rechargeable = eco-positive). High=rechargeable, no disposables; Low=requires disposable batteries.",review,14,battery_independence_salience,battery_independence_quality,B0BVVKKXFZ,rechargeable grooming kit – nice that its rechargeable so you can use whenever you need it,"product_positioning,maslow,purchase_motivation","benefits,self_actualization,functional","B0BVVKKXFZ,B0D5B8ZT1K,B0GL2DKVQH,B09138YH5R"
narrow_cutter_head,Narrow Cutter Head for Line Definition,窄刀頭線條定義,Blade Specs,attribute_function,Whether the product has a specifically narrow cutter head for creating clean beard/mustache lines. High=narrow head; Low=wide standard head.,both,10,narrow_cutter_head_salience,narrow_cutter_head_quality,B0842PLHY1,The narrow cutter head helps create clean lines for mustache or sideburns,"product_positioning,purchase_motivation","attributes,functional","B0842PLHY1,B0GL2DKVQH,B083NFMGZH"
attachment_nose_head_size_fit,Nose Trimmer Head Fit in Nostril,鼻毛刀頭鼻孔適配尺寸,Blade Specs,attribute_function,Whether the nose trimmer head is appropriately sized to fit comfortably in nostril. High=correctly sized; Low=too large or too small.,review,10,attachment_nose_head_size_fit_salience,attachment_nose_head_size_fit_quality,B0BVVKKXFZ,Bad size nose trimmer – The nose trimmer is useless as it is too large for the nose hair.,"product_positioning,maslow,purchase_motivation,wom_motivation","attributes,physiological,functional,altruistic","B06Y65N73X,B0823PD6XD,B0BVVKKXFZ,B0GL2GP74J"
product_dimensions_size,Product Physical Dimensions,產品實體尺寸規格,Design,attribute_function,Exact physical dimensions (length x width x depth in cm). Smaller dimensions = more portable.,both,8,product_dimensions_size_salience,product_dimensions_size_quality,B0842PLHY1,14 x 2 x 2 cm – compact slim profile for travel,"product_positioning,purchase_motivation","attributes,functional","B06Y65N73X,B0823PD6XD,B083NFMGZH,B0842PLHY1,B09138YH5R,B091C37P34,B0BRVTRPXM,B0BVVKKXFZ,B0D5B8ZT1K,B0GL2DKVQH,B0GL2GP74J"
battery_cover_ease,Battery Cover / Compartment Ease,電池蓋易用性,Design,attribute_function,Ease of accessing and replacing the battery compartment cover. High=easy open/close; Low=fiddly or hard to open.,review,6,battery_cover_ease_salience,battery_cover_ease_quality,B0BRVTRPXM,battery cover design for 2 AA batteries,product_positioning,attributes,"B06Y65N73X,B0823PD6XD,B0842PLHY1,B0BRVTRPXM,B0GL2GP74J,B091C37P34"
multi_use_versatility_score,Overall Multi-Use Versatility Score,全功能多用途評分,Functions,benefit_use,Composite sense of how many different grooming tasks the product can handle well. High=true all-in-one; Low=single-task only.,review,30,multi_use_versatility_score_salience,multi_use_versatility_score_quality,B0823PD6XD,"Perfect trimmer for all the little places – This trimmer kit includes everything you need to trim hair from all those odd places such as nose, ears, eyebrows, facial hair","product_positioning,maslow,purchase_motivation","benefits,self_actualization,functional","B06Y65N73X,B0823PD6XD,B083NFMGZH,B0842PLHY1,B09138YH5R,B091C37P34,B0BRVTRPXM,B0BVVKKXFZ,B0D5B8ZT1K,B0GL2DKVQH,B0GL2GP74J"
maintenance_requirement,Maintenance / Oiling Requirement,維護保養需求,Ease of Use,attribute_function,Whether the product requires regular oiling or maintenance to keep performance. High=low-maintenance; Low=requires frequent oiling.,review,8,maintenance_requirement_salience,maintenance_requirement_quality,B0BRVTRPXM,maintenance oil included in package,"product_positioning,purchase_motivation","usage_context_service_experience,functional","B06Y65N73X,B0823PD6XD,B083NFMGZH,B0842PLHY1,B09138YH5R,B091C37P34,B0BRVTRPXM,B0BVVKKXFZ,B0D5B8ZT1K,B0GL2DKVQH,B0GL2GP74J"
waterproof_body_full,Full Body Waterproof (Not Just Head),全機身防水,Waterproof,attribute_function,Whether the entire device body (not just the head) is waterproof. High=fully submersible body; Low=only head is water-resistant.,both,12,waterproof_body_full_salience,waterproof_body_full_quality,B0GL2DKVQH,IPX8 Waterproof – can be fully submerged,"product_positioning,maslow,purchase_motivation","attributes,safety,security","B0842PLHY1,B0BVVKKXFZ,B0D5B8ZT1K,B0GL2DKVQH,B0GL2GP74J"
grooming_kit_completeness,Grooming Kit Completeness,修容套組完整度,Accessories,benefit_use,How complete the grooming kit is for all common facial hair needs in one package. High=all-in-one complete kit; Low=partial kit.,review,22,grooming_kit_completeness_salience,grooming_kit_completeness_quality,B0823PD6XD,A nice selection of cutting heads – I have used a variety of different powered trimmers over the years but this one has the widest selection of trimming attachments.,"product_positioning,maslow,purchase_motivation","benefits,self_actualization,functional","B0823PD6XD,B0BVVKKXFZ,B0D5B8ZT1K,B0BRVTRPXM"
lightweight_design,Lightweight Design,輕量化設計,Design,benefit_use,Whether the product is specifically lightweight for ease of one-hand use and travel. High=very light; Low=heavier/bulkier.,both,18,lightweight_design_salience,lightweight_design_quality,B06Y65N73X,"Small and Safe Grooming Tool, Lightweight","product_positioning,maslow,purchase_motivation","benefits,physiological,functional","B06Y65N73X,B0823PD6XD,B083NFMGZH,B0842PLHY1,B09138YH5R,B091C37P34,B0BRVTRPXM,B0BVVKKXFZ,B0D5B8ZT1K,B0GL2DKVQH,B0GL2GP74J"
eyebrow_comb_attachment,Dedicated Eyebrow Comb Attachment,獨立眉毛導梳,Accessories,attribute_function,Whether a dedicated eyebrow guide comb is included. High=separate eyebrow comb included; Low=no dedicated eyebrow comb.,both,8,eyebrow_comb_attachment_salience,eyebrow_comb_attachment_quality,B0823PD6XD,includes eyebrow comb attachment,"product_positioning,purchase_motivation","attributes,functional","B0823PD6XD,B0BVVKKXFZ,B0D5B8ZT1K,B083NFMGZH,B091C37P34"
quick_touch_up_design,Quick Touch-Up / Daily Use Design,快速補修設計,Ease of Use,benefit_use,"Whether the product is optimized for quick daily touch-ups rather than full grooming sessions. High=fast, daily-use friendly; Low=setup-intensive.",review,16,quick_touch_up_design_salience,quick_touch_up_design_quality,B0GL2DKVQH,I needed something small and accurate for quick touch-ups between full shaves,"product_positioning,maslow,purchase_motivation","benefits,physiological,functional","B0GL2DKVQH,B0842PLHY1,B06Y65N73X,B083NFMGZH,B091C37P34"
product_perceived_premium,Perceived Premium Feel,質感高級感,Brand & Trust,brand_image,Whether the product feels premium/high-end beyond its price point. High=feels premium; Low=feels cheap for price.,review,14,product_perceived_premium_salience,product_perceived_premium_quality,B0BVVKKXFZ,I was not expecting it to be this good – I bought a ton of these kind of things over my lifetime and most of them are cheap garbage. But I was really not expecting a whole lot from these.,"product_positioning,maslow,purchase_motivation,wom_motivation","benefits,esteem,security,self_enhancement","B06Y65N73X,B0823PD6XD,B083NFMGZH,B0842PLHY1,B09138YH5R,B091C37P34,B0BRVTRPXM,B0BVVKKXFZ,B0D5B8ZT1K,B0GL2DKVQH,B0GL2GP74J"
grooming_angle_control,Grooming Angle / Attack Angle Control,修容角度控制,Ease of Use,benefit_use,Ease of controlling the trimming angle for precise detailing work. High=good angle control; Low=awkward angle.,review,10,grooming_angle_control_salience,grooming_angle_control_quality,B0GL2DKVQH,Grip is good and the attack angle allows accurate detailing,"product_positioning,purchase_motivation","functions,functional","B0GL2DKVQH,B083NFMGZH,B091C37P34,B0842PLHY1"
