attribute_key,label,label_zh,theme,attribute_group,definition,source_type,mention_count,salience_column,quality_column,example_review_id,example_quote,theory_families,theory_subtheories,applicable_products
storage_box_tray,Storage Box / Tray for Attachments,附件收納盒/托盤,Portability,benefit_use,Whether a box or tray is included to organize all attachments. High=well-organized box with slots; Low=loose attachments.,review,18,storage_box_tray_salience,storage_box_tray_quality,B0BVVKKXFZ,It is compact and stores away nicely in the container included.,"product_positioning,purchase_motivation","benefits,functional","B0823PD6XD,B0BVVKKXFZ,B0D5B8ZT1K"
cordless_during_use,Truly Cordless During Use,使用中完全無線,Portability,attribute_function,Whether the device operates completely cord-free during use (no tethering to charger). High=fully cordless; Low=must stay plugged in.,both,20,cordless_during_use_salience,cordless_during_use_quality,B0BVVKKXFZ,Mighty But Compact Facial & Body Hair Cordless Trimmer – This multi-functional groomer is cordless,"product_positioning,purchase_motivation","functions,functional","B06Y65N73X,B0823PD6XD,B083NFMGZH,B0842PLHY1,B09138YH5R,B091C37P34,B0BRVTRPXM,B0BVVKKXFZ,B0D5B8ZT1K,B0GL2DKVQH,B0GL2GP74J"
total_attachments_count,Total Attachments Count,附件總數,Accessories,attribute_function,Total number of attachments/heads included in the package. High=6+ items; Low=1-2 items.,both,28,total_attachments_count_salience,total_attachments_count_quality,B0823PD6XD,"6 Pieces Set – Beard Trimmer for Men, Waterproof Grooming Kit, 6 Pieces Set","product_positioning,purchase_motivation","attributes,functional","B06Y65N73X,B0823PD6XD,B083NFMGZH,B0842PLHY1,B09138YH5R,B091C37P34,B0BRVTRPXM,B0BVVKKXFZ,B0D5B8ZT1K,B0GL2DKVQH,B0GL2GP74J"
cleaning_brush_included,Cleaning Brush Included,隨附清潔刷,Accessories,attribute_function,Whether a cleaning brush is included. High=brush included; Low=no brush.,both,14,cleaning_brush_included_salience,cleaning_brush_included_quality,B0BRVTRPXM,cleaning brush included in package,"product_positioning,purchase_motivation","attributes,functional","B0BRVTRPXM,B0823PD6XD,B0BVVKKXFZ,B06Y65N73X"
maintenance_oil_included,Maintenance Oil Included,隨附保養油,Accessories,attribute_function,Whether lubricating/maintenance oil is included. High=oil included; Low=not included.,both,8,maintenance_oil_included_salience,maintenance_oil_included_quality,B0BRVTRPXM,maintenance oil included in package,product_positioning,attributes,B0BRVTRPXM
spare_blade_included,Spare Blade Included,隨附備用刀片,Accessories,attribute_function,Whether a spare replacement blade is included. High=spare blade included; Low=only one blade.,both,6,spare_blade_included_salience,spare_blade_included_quality,B0BRVTRPXM,2 blades included in package,"product_positioning,purchase_motivation","attributes,functional",B0BRVTRPXM
instruction_manual_quality,Instruction Manual Clarity,說明書清晰度,Accessories,benefit_use,"How clear and useful the instruction manual is. High=clear instructions, good translations; Low=confusing or missing.",review,10,instruction_manual_quality_salience,instruction_manual_quality_quality,B0823PD6XD,Works well! – The directions are straight foreword and even though it is made outside of the US no grammatical mistakes,"product_positioning,wom_motivation","usage_context_service_experience,altruistic","B06Y65N73X,B0823PD6XD,B083NFMGZH,B0842PLHY1,B09138YH5R,B091C37P34,B0BRVTRPXM,B0BVVKKXFZ,B0D5B8ZT1K,B0GL2DKVQH,B0GL2GP74J"
rounded_blade_tip,Rounded Safety Blade Tip,圓頭安全刀片,Safety,attribute_function,Whether the blade tip is rounded to prevent cuts inside nose/ears. High=rounded safety tip; Low=exposed sharp tip.,both,14,rounded_blade_tip_salience,rounded_blade_tip_quality,B06Y65N73X,"The rounded tip of the razor is great for trimming unneeded hairs in nose, ears, and around the face","product_positioning,maslow,purchase_motivation","attributes,safety,security","B06Y65N73X,B0823PD6XD,B0BVVKKXFZ,B0D5B8ZT1K"
painless_operation,Painless Operation,無痛操作,Safety,benefit_use,"Whether the trimmer operates without causing pain, pulling, or skin irritation. High=painless confirmed; Low=painful complaints.",review,22,painless_operation_salience,painless_operation_quality,B083NFMGZH,Compact and Painless Facial Hair Shaver,"product_positioning,maslow,purchase_motivation","benefits,physiological,functional","B06Y65N73X,B0823PD6XD,B083NFMGZH,B0842PLHY1,B09138YH5R,B091C37P34,B0BRVTRPXM,B0BVVKKXFZ,B0D5B8ZT1K,B0GL2DKVQH,B0GL2GP74J"
skin_friendly_blade,Skin-Friendly Blade,皮膚友善刀片,Safety,benefit_use,"Whether the blade material and design prevents skin scratching, redness, or irritation. High=no irritation; Low=scratching/redness issues.",both,16,skin_friendly_blade_salience,skin_friendly_blade_quality,B0842PLHY1,high-carbon steel blade from Japan ensuring safety without risk of scratching or hurting skin,"product_positioning,maslow,purchase_motivation","attributes,safety,security","B06Y65N73X,B0823PD6XD,B083NFMGZH,B0842PLHY1,B09138YH5R,B091C37P34,B0BRVTRPXM,B0BVVKKXFZ,B0D5B8ZT1K,B0GL2DKVQH,B0GL2GP74J"
low_noise_operation,Low Noise Operation,低噪音操作,Safety,attribute_function,Whether the device operates quietly. High=very low noise; Low=loud/noisy operation.,both,14,low_noise_operation_salience,low_noise_operation_quality,B09138YH5R,ultra-quiet and low-vibrant design effectively lowers the noise to less than 58db,"product_positioning,maslow,purchase_motivation","attributes,physiological,functional","B09138YH5R,B0BVVKKXFZ,B083NFMGZH,B091C37P34"
low_vibration_design,Low Vibration Design,低震動設計,Safety,attribute_function,Whether the device minimizes vibration for user comfort and pet safety. High=explicitly low vibration; Low=noticeable vibration.,both,8,low_vibration_design_salience,low_vibration_design_quality,B09138YH5R,ultra-quiet and low-vibrant design,"product_positioning,maslow","attributes,physiological","B09138YH5R,B0BVVKKXFZ"
build_quality_perception,Build Quality Perception,整體做工感受,Build Quality,attribute_function,"Perceived overall build quality and material feel. High=feels solid, premium; Low=feels cheap or flimsy.",review,35,build_quality_perception_salience,build_quality_perception_quality,B0BVVKKXFZ,My husband thought this was going to be cheap because it looks a bit cheap but he was pleasantly surprised at how great this ended up being.,"product_positioning,maslow,purchase_motivation","attributes,esteem,security","B06Y65N73X,B0823PD6XD,B083NFMGZH,B0842PLHY1,B09138YH5R,B091C37P34,B0BRVTRPXM,B0BVVKKXFZ,B0D5B8ZT1K,B0GL2DKVQH,B0GL2GP74J"
product_longevity,Product Longevity / Lifespan,產品使用壽命,Build Quality,attribute_function,How long the product lasts before failure. High=years of reliable use; Low=failure within weeks.,review,20,product_longevity_salience,product_longevity_quality,B0BVVKKXFZ,Stopped working in two weeks – This 4-in-1 Beard Trimmer is not so recommendable. It has stopped working after two weeks.,"product_positioning,maslow,purchase_motivation,wom_motivation","attributes,safety,security,altruistic","B06Y65N73X,B0823PD6XD,B083NFMGZH,B0842PLHY1,B09138YH5R,B091C37P34,B0BRVTRPXM,B0BVVKKXFZ,B0D5B8ZT1K,B0GL2DKVQH,B0GL2GP74J"
plastic_material_quality,Plastic Material Quality,塑料材質品質,Build Quality,attribute_function,"Quality and durability of plastic body materials. High=solid, durable plastic; Low=brittle or cheap-feeling plastic.",review,14,plastic_material_quality_salience,plastic_material_quality_quality,B0GL2DKVQH,"Fun Concept, Lacks in Craftsmanship – feels budget in hand","product_positioning,purchase_motivation","attributes,security","B06Y65N73X,B0823PD6XD,B083NFMGZH,B0842PLHY1,B09138YH5R,B091C37P34,B0BRVTRPXM,B0BVVKKXFZ,B0D5B8ZT1K,B0GL2DKVQH,B0GL2GP74J"
motor_durability,Motor Durability,馬達耐用性,Build Quality,attribute_function,Long-term durability and reliability of the motor. High=motor still going strong after heavy use; Low=motor fails early.,review,12,motor_durability_salience,motor_durability_quality,B0BVVKKXFZ,Stopped working in two weeks – The quality is not so great,"product_positioning,purchase_motivation","attributes,security","B06Y65N73X,B0823PD6XD,B083NFMGZH,B0842PLHY1,B09138YH5R,B091C37P34,B0BRVTRPXM,B0BVVKKXFZ,B0D5B8ZT1K,B0GL2DKVQH,B0GL2GP74J"
attachment_fitment,Attachment Head Fitment Quality,刀頭安裝配合度,Build Quality,attribute_function,"How securely and easily attachment heads click on and stay in place. High=secure, easy-click; Low=loose or hard to attach.",review,14,attachment_fitment_salience,attachment_fitment_quality,B0BVVKKXFZ,Good but hard to change heads – Overall this product works great. I have had a little difficulty changing heads,"product_positioning,purchase_motivation","attributes,functional","B06Y65N73X,B0823PD6XD,B083NFMGZH,B0842PLHY1,B09138YH5R,B091C37P34,B0BRVTRPXM,B0BVVKKXFZ,B0D5B8ZT1K,B0GL2DKVQH,B0GL2GP74J"
ease_of_use_overall,Ease of Use (Overall),整體易用性,Ease of Use,benefit_use,"Overall ease of learning and operating the trimmer. High=intuitive, beginner-friendly; Low=confusing or complex.",review,40,ease_of_use_overall_salience,ease_of_use_overall_quality,B0823PD6XD,Easy to use. Easy to change grooming options. Price.,"product_positioning,maslow,purchase_motivation","benefits,physiological,functional","B06Y65N73X,B0823PD6XD,B083NFMGZH,B0842PLHY1,B09138YH5R,B091C37P34,B0BRVTRPXM,B0BVVKKXFZ,B0D5B8ZT1K,B0GL2DKVQH,B0GL2GP74J"
ease_of_cleaning,Ease of Cleaning,清潔便利性,Ease of Use,benefit_use,How easy the trimmer is to clean after use. High=quick rinse or easy to brush; Low=hard to disassemble or clean.,review,28,ease_of_cleaning_salience,ease_of_cleaning_quality,B0BVVKKXFZ,It's very sturdy and easy to clean.,"product_positioning,purchase_motivation","benefits,functional","B06Y65N73X,B0823PD6XD,B083NFMGZH,B0842PLHY1,B09138YH5R,B091C37P34,B0BRVTRPXM,B0BVVKKXFZ,B0D5B8ZT1K,B0GL2DKVQH,B0GL2GP74J"
head_change_ease,Ease of Changing Attachment Heads,更換刀頭便利性,Ease of Use,benefit_use,"How easily users can switch between different trimmer heads. High=quick, no-tool swap; Low=difficult or confusing.",review,16,head_change_ease_salience,head_change_ease_quality,B0BVVKKXFZ,Good but hard to change heads,"product_positioning,purchase_motivation","functions,functional","B0823PD6XD,B0BVVKKXFZ,B0D5B8ZT1K"
on_off_switch_design,On/Off Switch Design,開關設計,Ease of Use,attribute_function,"Ease and intuition of the power switch. High=simple, clear switch; Low=confusing or hard to operate.",review,8,on_off_switch_design_salience,on_off_switch_design_quality,B0BVVKKXFZ,"Easy to swap heads, just lock in place",product_positioning,attributes,"B06Y65N73X,B0823PD6XD,B083NFMGZH,B0842PLHY1,B09138YH5R,B091C37P34,B0BRVTRPXM,B0BVVKKXFZ,B0D5B8ZT1K,B0GL2DKVQH,B0GL2GP74J"
initial_setup_ease,Initial Setup / Out-of-Box Experience,開箱初始設定,Ease of Use,benefit_use,Ease of setting up and using the product right out of box. High=ready to use immediately; Low=confusing setup.,review,12,initial_setup_ease_salience,initial_setup_ease_quality,B0GL2GP74J,Simple and ready to use mustache trimmer. This trimmer includes a battery so that you can operate the device right away.,"product_positioning,purchase_motivation","benefits,functional","B06Y65N73X,B0823PD6XD,B083NFMGZH,B0842PLHY1,B09138YH5R,B091C37P34,B0BRVTRPXM,B0BVVKKXFZ,B0D5B8ZT1K,B0GL2DKVQH,B0GL2GP74J"
gift_packaging_quality,Gift-Ready Packaging Quality,禮品包裝品質,Gifting,brand_image,"Quality and attractiveness of the retail box for gifting purposes. High=elegant, giftable box; Low=plain or damaged packaging.",review,22,gift_packaging_quality_salience,gift_packaging_quality_quality,B0BVVKKXFZ,Pleasantly surprised that this beard trimming kit came giftable: not your typical display box,"product_positioning,maslow,purchase_motivation,wom_motivation","benefits,esteem,relational,social_identity","B06Y65N73X,B0823PD6XD,B083NFMGZH,B0842PLHY1,B09138YH5R,B091C37P34,B0BRVTRPXM,B0BVVKKXFZ,B0D5B8ZT1K,B0GL2DKVQH,B0GL2GP74J"
gift_suitability_men,Gift Suitability for Men,男性禮品適合度,Gifting,brand_image,"Perceived suitability as a gift for men (spouse, father, boyfriend). High=ideal men's gift; Low=not mentioned as gift.",review,20,gift_suitability_men_salience,gift_suitability_men_quality,B0823PD6XD,The perfect gift! – I got this for my husband and he says he prefers this over any other top brand he has tried!,"product_positioning,maslow,purchase_motivation,wom_motivation","benefits,belongingness,relational,altruistic","B0823PD6XD,B0BVVKKXFZ,B0D5B8ZT1K,B0GL2GP74J,B0BRVTRPXM"
gift_suitability_women,Gift Suitability for Women,女性禮品適合度,Gifting,brand_image,Perceived suitability as a gift for women. High=widely bought as women's gift; Low=not positioned as women's gift.,review,8,gift_suitability_women_salience,gift_suitability_women_quality,B091C37P34,"pen-shaped, designed specifically for women's facial hair removal needs","product_positioning,maslow,purchase_motivation","benefits,belongingness,relational","B091C37P34,B083NFMGZH"
box_presentation,Box / Packaging Presentation,包裝展示效果,Gifting,brand_image,"Visual presentation and structure of product packaging. High=professional, well-structured box; Low=plain or flimsy.",review,14,box_presentation_salience,box_presentation_quality,B0BVVKKXFZ,Comes well packed looks pretty professional everything is exactly as advertised by the seller,"product_positioning,maslow","benefits,esteem","B06Y65N73X,B0823PD6XD,B083NFMGZH,B0842PLHY1,B09138YH5R,B091C37P34,B0BRVTRPXM,B0BVVKKXFZ,B0D5B8ZT1K,B0GL2DKVQH,B0GL2GP74J"
price_value_ratio,Price-to-Value Ratio,性價比,Price & Value,benefit_use,Perceived value relative to price paid. High=great value; Low=overpriced for quality delivered.,review,38,price_value_ratio_salience,price_value_ratio_quality,B0GL2DKVQH,"Solid Quality for the Cost – This trimmer is an excellent choice for anyone who needs a portable, low-profile grooming tool","product_positioning,maslow,purchase_motivation,wom_motivation","benefits,physiological,functional,altruistic","B06Y65N73X,B0823PD6XD,B083NFMGZH,B0842PLHY1,B09138YH5R,B091C37P34,B0BRVTRPXM,B0BVVKKXFZ,B0D5B8ZT1K,B0GL2DKVQH,B0GL2GP74J"
budget_tier_positioning,Budget Tier Positioning,價格帶定位,Price & Value,brand_image,"Whether the product is positioned as budget, mid-range, or premium. High=mid/premium perceived; Low=budget only.",review,12,budget_tier_positioning_salience,budget_tier_positioning_quality,B0GL2DKVQH,"Utter Junk – Very poor quality, very light weight and weak item. Its rechargeable but feels incredibly cheap","product_positioning,maslow","benefits,esteem","B06Y65N73X,B0823PD6XD,B083NFMGZH,B0842PLHY1,B09138YH5R,B091C37P34,B0BRVTRPXM,B0BVVKKXFZ,B0D5B8ZT1K,B0GL2DKVQH,B0GL2GP74J"
competitor_brand_comparison,Favorable vs Competitor Brands,優於競品品牌,Price & Value,brand_image,"Whether reviewers compare to competitor brands (Philips, Panasonic, Norelco) favorably. High=preferred over competitors; Low=loses to competitors.",review,16,competitor_brand_comparison_salience,competitor_brand_comparison_quality,B0823PD6XD,I got this for my husband and he says he prefers this over any other top brand he has tried!,"product_positioning,maslow,purchase_motivation,wom_motivation","benefits,esteem,functional,self_enhancement","B06Y65N73X,B0823PD6XD,B083NFMGZH,B0842PLHY1,B09138YH5R,B091C37P34,B0BRVTRPXM,B0BVVKKXFZ,B0D5B8ZT1K,B0GL2DKVQH,B0GL2GP74J"
primary_user_gender,Primary Target Gender,主要目標性別,Target User,brand_image,"Whether the product is explicitly designed for men, women, or unisex use. High=clear gender targeting; Low=unisex/ambiguous.",both,18,primary_user_gender_salience,primary_user_gender_quality,B091C37P34,Electric Eyebrow Trimmer for Women – specifically designed for women,"product_positioning,maslow","benefits,belongingness","B06Y65N73X,B0823PD6XD,B083NFMGZH,B0842PLHY1,B09138YH5R,B091C37P34,B0BRVTRPXM,B0BVVKKXFZ,B0D5B8ZT1K,B0GL2DKVQH,B0GL2GP74J"
unisex_suitability,Unisex / Gender-Neutral Suitability,男女通用適用性,Target User,brand_image,Whether the product works well for both men and women. High=truly unisex; Low=gender-specific design/function.,review,12,unisex_suitability_salience,unisex_suitability_quality,B083NFMGZH,"Eyebrow Trimmer for Men and Women, Precision Detailer for Shaping","product_positioning,purchase_motivation","benefits,functional","B083NFMGZH,B0823PD6XD,B0BVVKKXFZ"
beginner_friendliness,Beginner Friendliness,初學者友善度,Target User,benefit_use,Suitability for users who have never used a trimmer before. High=easy for first-timers; Low=requires skill.,review,14,beginner_friendliness_salience,beginner_friendliness_quality,B0GL2DKVQH,Game changer – This is my 1st time using a mustache trimmer. I usually used manual. This is great.,"product_positioning,maslow,purchase_motivation","benefits,self_actualization,functional","B06Y65N73X,B0823PD6XD,B083NFMGZH,B0842PLHY1,B09138YH5R,B091C37P34,B0BRVTRPXM,B0BVVKKXFZ,B0D5B8ZT1K,B0GL2DKVQH,B0GL2GP74J"
couple_shared_use,Couple / Shared Use Suitability,情侶/共用適用性,Target User,benefit_use,Whether the product is used and suitable for sharing between partners. High=reported shared use; Low=personal-only design.,review,10,couple_shared_use_salience,couple_shared_use_quality,B0BVVKKXFZ,My partner and I use this interchangeably. I mostly use only two attachments and they work great.,"product_positioning,maslow,purchase_motivation","benefits,belongingness,relational","B0BVVKKXFZ,B0823PD6XD,B083NFMGZH"
professional_home_positioning,Professional vs Home Use Positioning,專業/家用定位,Target User,brand_image,Whether the product targets professional barbers or home users. High=professional-grade; Low=home/personal use only.,both,10,professional_home_positioning_salience,professional_home_positioning_quality,B0BRVTRPXM,Professional facial hair trimmer,"product_positioning,maslow","attributes,esteem","B06Y65N73X,B0823PD6XD,B083NFMGZH,B0842PLHY1,B09138YH5R,B091C37P34,B0BRVTRPXM,B0BVVKKXFZ,B0D5B8ZT1K,B0GL2DKVQH,B0GL2GP74J"
blade_small_head_size,Small / Precision Blade Head Size,小型刀頭尺寸,Blade Specs,attribute_function,"Whether the blade head is specifically small for precision detailing. High=very small, fine head; Low=standard wide head.",both,14,blade_small_head_size_salience,blade_small_head_size_quality,B09138YH5R,"The trimmer has a small blade of only 1 cm, which can gently remove pet hair from difficult-to-reach areas","product_positioning,purchase_motivation","attributes,functional","B091C37P34,B083NFMGZH,B09138YH5R,B06Y65N73X"
rotary_blade_type,Rotary Cutting Mechanism,旋轉式刀頭設計,Blade Specs,attribute_function,Whether the trimmer uses a rotary (360-degree) cutting mechanism. High=rotary for nose/ear; Low=linear/reciprocating only.,both,8,rotary_blade_type_salience,rotary_blade_type_quality,B06Y65N73X,rotary ear and nose hair trimmer,"product_positioning,purchase_motivation","attributes,functional","B06Y65N73X,B0823PD6XD,B0BVVKKXFZ"
integrated_length_dial,Integrated Length Dial (No-Comb),刀片本身可調式（無需梳子）,Blade Specs,attribute_function,Whether the blade length is adjustable via built-in dial without needing separate comb attachments. High=integrated dial adjustment; Low=separate comb-only adjustment.,both,10,integrated_length_dial_salience,integrated_length_dial_quality,B0GL2DKVQH,adjustable blade (0.5mm to 14mm) delivers incredibly precise cuts,"product_positioning,purchase_motivation","attributes,functional","B0GL2DKVQH,B0842PLHY1"
product_listing_accuracy,Product Listing Accuracy,商品頁面描述準確度,Brand & Trust,usage_context_service_experience,Whether the actual product matches its Amazon listing description and photos. High=accurate listing; Low=misleading listing.,review,12,product_listing_accuracy_salience,product_listing_accuracy_quality,B0BVVKKXFZ,Came well packed looks pretty professional everything is exactly as advertised by the seller,"product_positioning,wom_motivation","usage_context_service_experience,altruistic","B06Y65N73X,B0823PD6XD,B083NFMGZH,B0842PLHY1,B09138YH5R,B091C37P34,B0BRVTRPXM,B0BVVKKXFZ,B0D5B8ZT1K,B0GL2DKVQH,B0GL2GP74J"
brand_trust_loyalty,Brand Trust / Repeat Loyalty,品牌信任度與回購,Brand & Trust,brand_image,"Level of brand trust with existing customers. High=repeat buyers, brand loyalty; Low=first-time skeptics.",review,18,brand_trust_loyalty_salience,brand_trust_loyalty_quality,B0GL2DKVQH,"I already had a nose hair trimmer by this brand, Urbaner, which works really well.","product_positioning,maslow,purchase_motivation,wom_motivation","benefits,belongingness,relational,social_identity","B06Y65N73X,B0823PD6XD,B083NFMGZH,B0842PLHY1,B09138YH5R,B091C37P34,B0BRVTRPXM,B0BVVKKXFZ,B0D5B8ZT1K,B0GL2DKVQH,B0GL2GP74J"
repeat_purchase_intent,Repeat Purchase Intent,回購意願,Brand & Trust,usage_context_service_experience,Whether reviewers mention buying again or having bought previous Urbaner products. High=strong repeat intent; Low=one-time purchase.,review,8,repeat_purchase_intent_salience,repeat_purchase_intent_quality,B0823PD6XD,I already had a nose hair trimmer by this brand and this one also works really well,"product_positioning,purchase_motivation,wom_motivation","usage_context_service_experience,relational,social_identity","B06Y65N73X,B0823PD6XD,B083NFMGZH,B0842PLHY1,B09138YH5R,B091C37P34,B0BRVTRPXM,B0BVVKKXFZ,B0D5B8ZT1K,B0GL2DKVQH,B0GL2GP74J"
cut_smoothness,Cut Smoothness / Glide Feel,裁剪滑順感,Sensory Experience,benefit_use,"How smooth the trimmer glides over skin during use. High=smooth glide; Low=rough, scratchy, or snagging motion.",review,20,cut_smoothness_salience,cut_smoothness_quality,B0BVVKKXFZ,"It cuts like a dream, bladerunner good","product_positioning,maslow,purchase_motivation","benefits,physiological,functional","B06Y65N73X,B0823PD6XD,B083NFMGZH,B0842PLHY1,B09138YH5R,B091C37P34,B0BRVTRPXM,B0BVVKKXFZ,B0D5B8ZT1K,B0GL2DKVQH,B0GL2GP74J"
operation_vibration_feel,Vibration Feel During Use,使用中的震動感,Sensory Experience,attribute_function,Perceptible vibration felt through the hand during use. High=minimal vibration; Low=strong vibration complaints.,review,8,operation_vibration_feel_salience,operation_vibration_feel_quality,B09138YH5R,ultra-quiet and low-vibrant design,"product_positioning,maslow","attributes,physiological","B06Y65N73X,B0823PD6XD,B083NFMGZH,B0842PLHY1,B09138YH5R,B091C37P34,B0BRVTRPXM,B0BVVKKXFZ,B0D5B8ZT1K,B0GL2DKVQH,B0GL2GP74J"
thick_hair_handling,Thick / Coarse Hair Handling,粗硬毛髮處理能力,Sensory Experience,attribute_function,Whether the trimmer handles thick or coarse hair without jamming. High=handles thick hair well; Low=jams or struggles.,review,16,thick_hair_handling_salience,thick_hair_handling_quality,B0GL2GP74J,"Convenient and easy to use, but a bit weak on thicker beard – I do have particularly thick beard hair and there were times when this trimmer struggled","product_positioning,purchase_motivation,wom_motivation","functions,functional,altruistic","B06Y65N73X,B0823PD6XD,B083NFMGZH,B0842PLHY1,B09138YH5R,B091C37P34,B0BRVTRPXM,B0BVVKKXFZ,B0D5B8ZT1K,B0GL2DKVQH,B0GL2GP74J"
trimming_evenness,Trimming Evenness / Uniformity,修剪均勻度,Sensory Experience,attribute_function,Whether trimming results are even and uniform across the treated area. High=consistently even cuts; Low=uneven results.,review,14,trimming_evenness_salience,trimming_evenness_quality,B0GL2DKVQH,"Looks great, performs decently, but feels budget in hand","product_positioning,purchase_motivation","functions,functional","B06Y65N73X,B0823PD6XD,B083NFMGZH,B0842PLHY1,B09138YH5R,B091C37P34,B0BRVTRPXM,B0BVVKKXFZ,B0D5B8ZT1K,B0GL2DKVQH,B0GL2GP74J"
grey_hair_handling,Grey / Coarse Grey Hair Handling,白/灰髮處理能力,Hair Capability,attribute_function,Effectiveness on grey or coarse grey hair specifically. High=handles grey hair well; Low=struggles with grey hair.,review,6,grey_hair_handling_salience,grey_hair_handling_quality,B0BVVKKXFZ,it is small but powerful – the shaver removes even thicker grey facial hair,"product_positioning,purchase_motivation","functions,functional","B0BVVKKXFZ,B0GL2DKVQH"
close_shave_capability,Close-Shave / Near-Skin Capability,貼膚剃光能力,Hair Capability,attribute_function,Whether the trimmer can trim hair down to near skin level. High=skin-close possible; Low=leaves visible stubble.,review,12,close_shave_capability_salience,close_shave_capability_quality,B0GL2DKVQH,It's not smooth-skin close but for mustache trimming it's exactly right,"product_positioning,purchase_motivation","functions,functional","B0842PLHY1,B0GL2DKVQH,B0BRVTRPXM,B0BVVKKXFZ"
fine_hair_precision,Fine / Thin Hair Precision,細軟毛髮精準度,Hair Capability,attribute_function,"Effectiveness on fine, thin, or soft hair. High=works well on fine hair; Low=misses fine hair.",review,10,fine_hair_precision_salience,fine_hair_precision_quality,B0GL2DKVQH,Price is good and feels decent – My facial hair is very thin and this doesn't catch all of them,"product_positioning,purchase_motivation","functions,functional","B091C37P34,B083NFMGZH,B0GL2DKVQH"
social_gifting_context,Purchased as Gift Context,作為禮品購買場景,Social Context,usage_context_service_experience,"Whether the product is bought as a gift (for husband, father, boyfriend). High=strong gifting purchase pattern; Low=self-purchase only.",review,20,social_gifting_context_salience,social_gifting_context_quality,B0823PD6XD,Got as a gift for my husband and he absolutely loves it. Definitely worth it,"maslow,purchase_motivation,wom_motivation","belongingness,relational,altruistic","B06Y65N73X,B0823PD6XD,B083NFMGZH,B0842PLHY1,B09138YH5R,B091C37P34,B0BRVTRPXM,B0BVVKKXFZ,B0D5B8ZT1K,B0GL2DKVQH,B0GL2GP74J"
